{
  "exam": "bpsc",
  "year": 2025,
  "sourceSummary": "Official / verified source summary goes here",
  "questions": [
    {
      "id": "bpsc-2025-paper1-q001",
      "paper": "Paper name",
      "stage": "Prelims",
      "date": null,
      "shift": null,
      "subject": "History",
      "topic": "Modern History",
      "question": "Question text",
      "question_hi": null,
      "options": ["Option A", "Option B", "Option C", "Option D"],
      "options_hi": null,
      "answer": 0,
      "explanation": null,
      "explanation_hi": null,
      "source": {
        "type": "official",
        "label": "Official question booklet",
        "url": null,
        "verified": true,
        "retrieved": "2026-09-16"
      }
    }
  ]
}
